,titulo,fecha,texto
0,La negociación de acciones a través de celular logra récord,2021-04-29,"
Las firmas comisionistas de la Bolsa de Valores de Colombia (bvc) realizan en promedio al día entre 2.800 y 3.000 operaciones en compra y venta de acciones. (Lea: Colombia ya no es grado de inversión... al menos para ‘traders’)Ayer, con la plataforma digital trii, que trabaja en alianza con la firma Acciones y Valores, se realizaron 8.450, aunque influyó el hecho de que para la jornada se había programado que no se cobrarían comisiones.
sas.cmd.push(function() { sas.call(""std"", { siteId: sas_siteId, pageId: sas_pageId, formatId: 9343, target: sas_target });});De todas maneras, el resultado es diciente sobre la nueva forma en la que las personas naturales pueden entrar como inversionistas al mundo de las acciones, en un momento en el que el gobierno la bvc y los mercados buscan alternativas para dinamizar un sector con una baja liquidez, poca oferta de títulos de renta variable y alta concentración de la propiedad.En el mercado de ayer en la bvc se transaron en total $93.076 millones y el índice accionario Colcap cerró en 1.286,16 unidades y registró una caída de -0,63%.Trii y Acciones & Valores dijeron que en la jornada hubo 12.435 participantes y se presentaron 10.000 nuevas descargas.La plataforma aseguró que desde que comenzó a funcionar, el primero de marzo, se han realizado 45.000 descargas, 15.000 usuarios han operado en compra y venta de títulos y se habían realizado 20.000 transacciones sin contar las de ayer.Los fundadores de la aplicación trii habían dicho que en conmemora el Día Nacional del Árbol en Colombia no se iba a cobrar comisión para la compra y venta de acciones desde la aplicación, como una manera de incentivar la inversión.La meta era superar las 1.500 operaciones a través de la aplicación ayer, cifra que se multiplicó mas de cinco veces.La aplicación está dirigida a quienes están interesados en invertir de manera activa en cerca de 24 acciones del índice de capitalización Colcap, de bvc.PERSONAS NATURALESHasta el momento trii es la única aplicación móvil que existe en el país para comprar y vender acciones colombianas de forma 100% digital y está orientada a cualquier persona que esté interesada en invertir en el mercado accionario, sin necesidad de ser un experto, ni tener mucho dinero para invertir. Los pasos que debe seguir para entrar a comprar o vender acciones es descargar el ‘app’, ver los videos que explican su funcionamiento, y empezar a comprar y vender acciones. Acciones & Valores asesora al cliente en cómo funciona el proceso de inversión.La persona que quiera descargar trii a su celular lo podrá hacer desde el Google Play Store, App Gallery o el Apple App Store.El cliente después deberá registrarse, llenar una encuesta de perfil de riesgo, y cargar su cuenta por PSE. Una vez terminado este proceso, podrá empezar a invertir en el mercado accionario.Los fundadores de la aplicación dijeron que están expandiendo la operación a Perú y Chile.Esteban Peñaloza, cofundador y CEO de trii dijo que la plataforma “ha creado un fenómeno imparable y a pesar de que se registraron dos ataques informáticos, logró que se realizaran operaciones récord en la bvc”.TECNOLOGÍA, LA CLAVEPor su parte, Luis Felipe Aparicio, vicepresidente comercial de Acciones & Valores, aseguró que la firma, que tiene 60 años en el mercado, ha visto en la tecnología una opción para democratizar el mercado de valores y con ella se puede llegar a mas inversionistas y reafirmó que “este es un camino por el que se debe continuar trabajando y desarrollando”.“Estamos viendo una verdadera revolución tecnológica, en donde las personas son las protagonistas. Para la bolsa siempre ha sido una obsesión que el mercado de capitales sea una opción cercana y fácil para las personas al momento de invertir. Y vemos en diversas plataformas y ahora en trii, innovación y tecnología que acercan a las personas desde por ejemplo sus teléfonos, a que sea más fácil, cotidiano, y normal su participación e interés en el mercado de capitales”, afirma Juan Pablo Córdoba, presidente de la bvc."
1,Impuesto vehicular y peajes urbanos alertan al transporte,2021-04-29,"
Como muchos sectores, los transportadores expresaron sus reparos al proyecto de Ley de Solidaridad Sostenible, la nueva reforma tributaria y fiscal presentada por el Gobierno en las últimas semanas.(Lea: Los otros caminos que podría explorar la reforma tributaria)Portafolio conoció que tanto la Federación Colombiana de Transportadores de Carga y su Logística (Colfecar) como la Federación de Empresarios del Transporte de Carga (Fedetranscarga) enviaron cartas al presidente Iván Duque, en la que expresaron preocupaciones sectoriales.(Lea: Gobierno cede y revisaría IVA a servicios públicos y gasolina)
sas.cmd.push(function() { sas.call(""std"", { siteId: sas_siteId, pageId: sas_pageId, formatId: 9343, target: sas_target });});Uno de los llamados se hizo en torno al Capítulo V del proyecto (art. 143 a art. 152), que establece la creación de un nuevo impuesto nacional de vehículos, que se aplicará a los propietarios de estos, ya sean nuevos, usados, o que temporalmente se internen en el territorio nacional. Según el articulado, “la renta del impuesto nacional a vehículos corresponderá a los municipios, distritos y departamentos”. El gravamen está definido por dos elementos: el valor comercial y el factor de contaminación del vehículo, y aplicaría para los automotores particulares y motos, vehículos de transporte público de pasajeros y de carga, y también los eléctricos e híbridos.Para Colfecar, “resulta contradictorio argumentar que se quiere promover la sostenibilidad ambiental proponiendo gravar los combustibles fósiles, así como los vehículos de carga, y al mismo tiempo se proponga eliminar las exenciones que hay para el biodiésel, y la imposición de impuestos a los vehículos eléctricos y a las bicicletas”. En la carta de este gremio, los transportadores argumentaron que “en la actualidad los vehículos de transporte de carga que utilizan diésel ya se encuentran contribuyendo con la mitigación de su impacto ambiental”, por medio del Impuesto Nacional al Carbono, por lo que el componente de contaminación que contempla la norma para el nuevo gravamen, “resulta redundante y al final un sobrecosto más”.Además, los gremios también criticaron en la carta el efecto del impuesto al combustible, que según estimaciones de Colfecar generaría un sobrecosto anual para el sector transporte de $1,14 billones al año. También la imposición de IVA a servicios postales y de paquetería, que según Colfecar resultaría en un incremento del 19% en el servicio de transporte de mensajería, y también la propuesta de los peajes urbanos. Al respecto, José Stalin Rojas, director del Observatorio de Logística, Movilidad y Territorio de la Universidad Nacional, dice que “la reforma tributaria tiene como fin recaudar, pero va en contra de otras políticas que ha impulsado el Gobierno Nacional, y tiene como efecto colateral afectar la movilidad eléctrica”.De acuerdo con el experto, el proyecto neutraliza los incentivos existentes para el uso de bicicletas eléctricas, mientras que el gravamen a los combustibles, “no tendría un efecto negativo en los costos operacionales del transporte, porque estos están migrando hacia una movilidad eléctrica, pero a mediano plazo sí tendría un impacto en los usuarios de vehículos”. En lo que va del año, el Ministerio de Transporte ha sostenido 50 reuniones con los gremios transportadores para revisar sus preocupaciones en torno al sector y también a la reforma. Portafolio consultó a la cartera, pero no recibió un pronunciamiento oficial sobre el proyecto.PEAJES URBANOSOtro de los cuestionamientos gira en torno al art. 156 del proyecto, que propone que las ciudades capitales instalen peajes dentro de su jurisdicción, como fuente de financiación para la infraestructura de movilidad, “sin que medie concepto vinculante previo del Ministerio de Transporte”.Fedetranscarga argumentó en su misiva que “es hoy relevante el proyecto que cursa en la Cámara sobre la disminución del valor y número de peajes en el país. Esta propuesta se sumará a las 177 casetas que existen actualmente, las 34 programadas a ser instaladas antes que termine el gobierno y las alzas que se dan exorbitantemente en las casetas de la ANI cada vez que se entrega una unidad de obra por las correspondientes concesiones. Seguramente estos valores, una vez se instalen en las capitales estos nuevos peajes, igualmente se trasladaran al comprador de los productos transportados”.LOS SISTEMAS MASIVOSAlgunas peticiones para el sector también fueron incluidas en el articulado, como el apoyo a los sistemas de transporte masivo que solicitó Asocapitales y los siete sistemas, que acumulan un déficit de $2 billones.El art. 32 establece ""esquemas de cofinanciación, con el apoyo de las entidades territoriales, para los sistemas integrados de transporte masivo"", y así suplir el déficit por la pandemia. El aporte sería de 50%, y sería girado por Hacienda con recursos del Fondo de Mitigación de Emergencias (Fome)."
2,Vacunación para mayores de 60 años arranca este viernes,2021-04-29,"
Este viernes 30 de abril comienza la vacunación para personas mayores de 60 años en todo el territorio nacional. “Es vital porque al ir cubriendo estos sectores poblacionales, estamos protegiendo a ese sector de la población donde se ha concentrado la mayor cantidad de letalidad de este virus”, así lo afirmó el presidente Iván Duque durante la transmisión de Prevención y Acción.
sas.cmd.push(function() { sas.call(""std"", { siteId: sas_siteId, pageId: sas_pageId, formatId: 9343, target: sas_target });});Asimismo, el mandatario afirmó que para la tercera semana de mayo se iniciará la etapa tres de la vacunación.¿Quiénes están incluidos en la etapa tres de vacunación?-Agentes educativos-Madres y padres comunitarios vinculados a los servicios de infancia e identificados por el ICBF-Docentes-Directivos docentes-Personal administrativo de centros de educación inicial, preescolar, básica primaria, básica secundaria y educación media.​-Los cuidadores institucionales de niños, niñas y adolescentes del ICBF.-Talento humano encargado de atención y el cuidado de adultos mayores institucionalizados.-Personal activo de las Fuerzas Militares y de Policía y el que sea llamado de reserva activa.-Las personas que están en los servicios de Policía judicial y el Cuerpo Técnico de Investigaciones que acompañan la labor de la Fuerza Pública.-Las personas entre 16 y 59 años con comorbilidades (enfermedades hipertensivas, diabetes, insuficiencia renal, VIH, cáncer, tuberculosis, EPOC, asma, obesidad)-Las personas que están en las listas de transplantes de órganos.-Cuidadores de adultos mayores en atención domiciliaria identificados por un prestador de servicios de salud.-Guardia Indígena y Guardia Cimarrona.​POLÍTICA / EL TIEMPO@PoliticaET"
3,Programe su viaje con tiempo: así está la movilidad por nuevas marchas,2021-04-29,"
Tras la masiva manifestación del pasado miércoles, en la que se marchó contra la reforma tributaria propuesta por el Gobierno nacional, el asesinato de líderes sociales y las deficiencias en atención en salud, entre otros temas, el Comité Nacional de Paro convocó hoy una nueva jornada de movilizaciones.Siga acá el minuto a minuto de la nueva jornada que avanza en el país y que registra afectaciones vales el algunos corredores viales.
sas.cmd.push(function() { sas.call(""std"", { siteId: sas_siteId, pageId: sas_pageId, formatId: 9343, target: sas_target });});6:20 p.m.Se presenta movilización ajena a la operación en la Av.  Jiménez por la troncal Caracas sentido norte. Sin paso hacia el norte.5:39 p.m.Manifestaciones de troncal Suba se concentran en sector Campiña.Se Habilitan estaciones de:Puente LargoSuba Calle 116Niza - Calle 127Suba - Av. Boyacá Gratamira21 Ángeles.5:31 p.m.​Transmilenio suspende operación en algunos puntosTransmilenio informó a esta hora que se cancela el servicio de alimentación en:-Portal Américas,-Estación Banderas,-Suba-Portal Sur-Ruta circular San Mateo,-Portal ElDorado y costado de Fontibón4:34 p.m. Se presenta bloqueo en la troncal Suba, por movilización que llega a estación Transv. 91 en sentido oriente - occidente. Sin paso en el punto. Flota hace retorno en  estación 21 Ángeles.#TMahora (4:34 p.m.) Se presenta bloqueo en la troncal Suba, por movilización que llega a estación Transv. 91 en sentido oriente - occidente. Sin paso en el punto. Flota se prepara para retornar en estación 21 Ángeles. pic.twitter.com/nifce1hws0— TransMilenio (@TransMilenio) April 29, 2021 12:48 p.m.En estos momentos se dejan de operar las estaciones TransMilenio:ChinchetaSan VictorinoChinchetaSan DiegoChinchetaLas Nieves.11:40 a.m.Desvíos en la operación de TransMilenio en BogotáEn estos momentos se presenta una movilización ajena a la operación en la Cra.7 con calle 36, sentido norte-sur, flota dual lleva a cabo desvío por calle 39 al occidente para tomar carrera 13 al sur y retomar calle 24 al oriente con acompañamiento de policía.11:20 a.m.Programe sus viajes porque hay cierres y pasos restringidos en algunas víasCierre total de la vía Armenia- Zarzal en ambos sentidos, kilómetro 20, sector Corozal debido a manifestaciones.Cierre total de la vía Bogotá- Manizales. La misma situación se presenta en la vía Fresno- Mariquina, en ambos sentidos.Vía Cali – Ipiales: Paso restringido por mantenimiento vial sector Las Yescas. Paso a un carril por deslizamiento sector El Palmar km 19+900. Paso a un carril por deslizamiento sector La Esperanza km 34+400.Bucaramanga - Bogotá: hay paso alternado.10:50 a.m.Cacerolazos y manifestaciones en CaliPese a la medida del toque de queda en la ciudad de Cali, en algunos puntos ya se registran concentraciones protestando en contra de la reforma tributaria.10:40Bloqueos en la vía Facatativá - BogotáDurante la mañana algunos manifestantes bloquearon el paso en esta vía. El gobernador de Cundinamarca, Nicolás García, informó que enviaron miembros de la Policía para abrir, ya que no se estaba permitiendo el ""paso del oxígeno para los enfermos de cuidado intensivo del Hospital San Rafael. Se está atentando contra la vida de los cundinamarqueses de ese hospital"", aseguró minutos antes de la habilitación del paso. 9:20 a.m.En Bogotá, manifestaciones empiezan a las 10:00 a.m.Se espera que los manifestantes se reúnan en el Parque Nacional y el Parque de los Hippies. Según lo difundido en redes sociales, el plan es desplazarse hacia la Plaza de Bolívar, el sitio donde se congregó la mayoría de manifestantes ayer.16 estaciones de Transmilenio están sin servicio.8:17 a.m.Plantones en dos puntos del Valle del CaucaCon banderas y ollas, alrededor de 15 personas realizan en la mañana de este jueves bloqueos intermitentes en la vía que de Cali conduce a Buenaventura, en el Valle del Cauca.Los bloqueos se registran en el kilómetro 24+800, sector San Marcos y Siete Curvas, jurisdicción del municipio de Vijes.Además, autoridades registran intentos de bloqueo en la salida de Cali hacia Yumbo, en ambos sentidos."
4,"Juegos de suerte y azar, con otro impulso para  reactivar su economía",2021-04-29,"
El presidente de Coljuegos, César Augusto Valencia Galiano, dio a conocer nuevas medidas que entrarán en vigencia desde esta semana y que buscan reactivar los juegos de suerte y azar, particularmente en el segmento de localizados, donde están los casinos y bingos.“Nuestro propósito es sacar adelante esta industria tan importante para las finanzas públicas y para la salud de los colombianos, con todas las herramientas de política pública que nos permite la Ley”, subrayó Valencia Galiano.
sas.cmd.push(function() { sas.call(""std"", { siteId: sas_siteId, pageId: sas_pageId, formatId: 9343, target: sas_target });});La resolución, con fecha 26 de abril de 2021, establece consideraciones especiales para los compromisos de pago de los derechos de explotación y gastos de administración de las cuotas causadas entre los meses de septiembre de 2020 y marzo de 2021 que se encuentren en mora: “La aprobación de los compromisos de pago suspenderá los informes de supervisión por incumplimiento contractual, para los concesionarios que hagan uso del presente mecanismo, salvo que se incumplan los compromisos de pago aprobados (...) en el evento en el que se hayan trasladado los informes de supervisión por parte de la Gerencia de Seguimiento Contractual a la Vicepresidencia de Operaciones, y se aprueben los compromisos de pago, se dará por terminada la actuación administrativa”.Para la suscripción de los compromisos de pago, los concesionarios de juegos de suerte y azar en la modalidad de localizados deberán cumplir, entre otros requisitos, con la suscripción por una sola vez para cada contrato de concesión. “Los operadores deben realizar un análisis de su situación financiera y presentar una única solicitud que recoja las obligaciones que incluirán en el compromiso, las cuales no podrán exceder tres cuotas mensuales en mora y limitarse a financiar los derechos de explotación y gastos de administración causados y en mora entre los meses de septiembre de 2020 hasta marzo de 2021”, sostiene la resolución.El presidente de Coljuegos recordó que sólo en el primer trimestre (enero, febrero, marzo) del 2021, este sector ha registrado ventas totales por 3,8 billones de pesos, lo que significa un crecimiento del 84 por ciento frente a igual periodo del 2020 cuando las ventas ascendieron a 2 billones de pesos”. “En derechos de explotación de juegos de suerte y azar nacionales, al cierre del 2020 se recaudaron 393.827 millones de pesos, que se suman a ese récord de más de 4 billones de pesos que esta entidad ha logrado recaudar desde el comienzo de la entidad”, afirmó. De hecho, agregó, el primer trimestre de 2021 el recaudo ascendió a 155.874 millones de pesos, lo que significa un aumento del siete por ciento frente a igual periodo de 2020 cuando se recaudaron 146.338 millones de pesos (del total recaudado, 54.841 millones de pesos corresponden a juegos localizados y 39.976 millones de pesos a juegos “on line”)."
5,Colombia superó este jueves las 500 muertes diarias por Covid,2021-04-29,"
El Ministerio de Salud confirmó este jueves 17.308 nuevos casos, luego procesar 54.649 pruebas PCR y 34.758 de antígenos en las últimas 24 horas. Con esta cifra, el número total de casos en Colombia llegó a 2.841.934.Po su parte, se reportaron 505 fallecimientos más por covid-19, lo que elevó a 73.230 el total de muertes en el país por este virus.Así mismo, el número de recuperados ascendió a 2.650.643. En Colombia actualmente hay 108.611 casos activos.
sas.cmd.push(function() { sas.call(""std"", { siteId: sas_siteId, pageId: sas_pageId, formatId: 9343, target: sas_target });});#ReporteCOVID19 29 de abril:17.944 recuperados17.308 nuevos casos505 fallecidosMuestras: 89.407PCR: 54.649Antígeno: 34.758Total:2.650.643 recuperados2.841.934 casos 73.230 fallecidos 14.715.576 muestras procesadas108.611 casos activoshttps://t.co/SiKTpTCQ3W pic.twitter.com/RDYvLqAqjR— MinSaludCol (@MinSaludCol) April 29, 2021 "
6,"Llegan más vacunas, pero suspenden envío por manifestaciones",2021-04-29,"
Dos noticias relacionadas con el plan nacional de vacunación se conocieron este jueves. Por un lado, el Ministerio de Salud anunció la llegada al país de un nuevo lote de 549.900 dosis de vacunas del laboratorio Pfizer.La mala noticia, es que por cuenta de las manifestaciones en el Valle se suspende hasta el próximo domingo 2 de mayo los envíos de dosis programados para el departamento. El anuncio fue hecho por el ministro de Salud, Fernando Ruiz, a través de sus redes sociales, en las que señaló que la decisión se tomó por solicitud de la Secretaría de Salud del Valle que no tiene las garantías para su traslado.  
sas.cmd.push(function() { sas.call(""std"", { siteId: sas_siteId, pageId: sas_pageId, formatId: 9343, target: sas_target });});Por solicitud de la @SecreSaludValle justificada en la severa afectación del orden público, hemos tomado la dolorosa decisión de suspender hasta el domingo 2 de mayo los envíos programados de vacunas al departamento. @MinSaludCol lamenta la situación @infopresidencia— Fernando Ruiz (@Fruizgomez) April 29, 2021 Con la llegada de las 549.900 vacunas de Pfizer, ya son más de 8 millones de dosis en el país. "
7,Colombia ya no es grado de inversión... al menos para ‘traders’,2021-04-29,"
Los bonos de Colombia en dólares se cotizan como si ya no tuvieran grado de inversión, a medida que inversionistas apuestan que el Gobierno no logrará aumentar los impuestos lo suficiente como para que la deuda del país no caiga hacia un terreno de especulación.(Lea: Gobierno cede y revisaría IVA a servicios públicos y gasolina)Los bonos internacionales del país tienen el peor desempeño en América Latina desde que el Gobierno presentó una reforma tributaria hace dos semanas, la cual recibió una oposición generalizada.(Lea: Gremios fijan posición sobre la reforma tributaria)
sas.cmd.push(function() { sas.call(""std"", { siteId: sas_siteId, pageId: sas_pageId, formatId: 9343, target: sas_target });});Los costos de endeudamiento de Colombia están más o menos en línea con los de países con calificación de grado especulativo como Brasil, Guatemala, Uzbekistan y Azerbaiyan, lo que refleja pesimismo de que el país logre corregir su déficit. El Gobierno colombiano tenía contemplado recaudar hasta 2,2% del producto interno bruto en promedio por año durante la próxima década a través de aumentos de cargas tributarias y restricciones al gasto. Pero la fuerte oposición al proyecto de ley en el Congreso y por parte de manifestantes obligó al Gobierno a recortar muchas de las medidas clave destinadas a incrementar los ingresos. Ahora que los inversionistas están descontando una alta probabilidad de una rebaja de calificación, el diferencial promedio de los bonos soberanos del país se ha ampliado en 20 puntos básicos este mes, a 2,31 puntos porcentuales por encima de los bonos del Tesoro de Estados Unidos, según datos compilados por JPMorgan. La prima de riesgo promedio para países con grado de inversión es de 1,47 puntos porcentuales. ""Los participantes del mercado estarán observando de cerca para evaluar cuanta dilución genera la propuesta de la Administración"", escribieron Alejo Czerwonko y Brennan Azevedo, economistas de UBS Global Wealth Management, en una nota esta semana. ""Se considera que ahorros inferiores al 1% del PIB aumentan significativamente las posibilidades de que las agencias de calificación tomen medidas"". La reforma tributaria no se ha enfrentado a su primer debate en el Congreso, pero ya está en la cuerda floja pues casi todos los partidos políticos se oponen, incluido el Centro Democrático del mismo presidente Iván Duque. Los detractores se oponen al aumento de los impuestos a la clase media, y los partidos no están dispuestos a respaldar medidas dolorosas e impopulares antes de las elecciones presidenciales y del Congreso el próximo año. Miles de personas salieron a las calles el miércoles a protestar contra la reforma y algunas manifestaciones continuaron el jueves, incluso cuando el país es victima de un numero record de muertes por coronavirus. Muchos países latinoamericanos también están lidiando con déficits que se dispararon durante la pandemia, pero a diferencia de Brasil, México, Chile y Perú, el déficit de Colombia se ampliará en lugar de reducirse este año, según pronósticos del Fondo Monetario Internacional. DÉFICIT RECORD La economía sufrió su mayor contracción en la historia el año pasado, y el Gobierno estima que el déficit fiscal de Colombia se ampliará a más de 9% del PIB este año, desde 2,5% en 2019, antes de la pandemia. El ministro de Hacienda, Alberto Carrasquilla, está en conversaciones con los legisladores para salvar el proyecto de ley, pero muchos están exigiendo que la iniciativa se retire por completo. Actualmente, Fitch Ratings y S&P Global Ratings califican a Colombia un nivel por encima del de grado especulativo. Ambas agencias han dicho que el proyecto de ley es clave para que el país garantice la sostenibilidad fiscal, y S&P ha advertido que podría tomar medidas sobre la perspectiva negativa en los próximos 12 meses si no se revierte el deterioro de las finanzas publicas. Bloomberg "
