,titulo,fecha,texto
0,Con la reforma tributaria habría más impuestos a los vehículos,2021-04-25,"
Gobierno con su ‘Ley de solidaridad sostenible’ ni los colombianos con esa reforma tributaria. Sobre el papel y antes de que empiece el debate, el Ejecutivo tendrá que esforzarse al máximo para que el Congreso se la apruebe, y si eso ocurre, en el caso particular de los dueños de vehículos de dos, cuatro o más ruedas tendrán que sacar más plata de sus bolsillos para moverlos.(Lea: IVA a combustibles costaría $1,9 billones más a los consumidores)Por ahora, al Gobierno no le cuadran las cuentas pues no tiene mayorías ni en el Senado ni en la Cámara para sacarla adelante. Las críticas contra la reforma son muchas, al punto de que partidos como el Liberal y Cambio Radical se niegan a votarla. Este último, además, pidió retirarla.
sas.cmd.push(function() { sas.call(""std"", { siteId: sas_siteId, pageId: sas_pageId, formatId: 9343, target: sas_target });});Esto, a pesar de que el Ministerio de Hacienda advirtió al Congreso de las graves consecuencias en materia económica y de sostenibilidad fiscal en caso de que no sea aprobada. Y no es solo la inconveniencia que alegan muchos por el mal momento económico que pasan miles de familias, sino por algunas incongruencias que han salido a flote en el texto.En lo que tiene que ver con los vehículos, uno de los artículos contradictorios tiene que ver con los vehículos eléctricos e híbridos. El año pasado el presidente Iván Duque anunció su muy publicitada Estrategia Nacional de Movilidad Eléctrica y Sostenible. En su lanzamiento, e incluso a través de la Ley 1964 de 2019, anunció acciones necesarias e incentivos para “acelerar la transición hacia la movilidad eléctrica”, y puso como meta la incorporación de 600.000 vehículos eléctricos a 2030.Hoy están libres del impuesto al valor agregado (IVA) y del consumo, mientras que los híbridos pagan un 5 por ciento de IVA y el 8 o 16 por ciento del impuesto al consumo. Con la reforma, estos vehículos pagarían IVA del 19 por ciento como el resto de automóviles y se derogaría la medida que permite importarlos con cero arancel.Con esta decisión, se incrementa el precio de un vehículo ‘verde’ cerca de un 30 por ciento, lo cual alejaría a los compradores y pondría al país más lejos de las ambiciosas metas que planteó el presidente Duque.La reforma crea el nuevo impuesto nacional de vehículos al que se le agregaría un componente de cuidado medioambiental. También aumenta la sobretasa a los combustibles. Este impuesto se aplicaría a todo tipo de vehículos, con excepción de las bicicletas, maquinaria agrícola y maquinaria pesada. Las tarifas se aplicarían según el avalúo comercial de acuerdo con los siguientes rangos de precios: de $ 0 a $ 49,4 millones, 1,5 por ciento; de $ 49,4 millones a $ 111,3 millones: 2,5 por ciento; de $ 11,3 millones en adelante, 3,5 por ciento. Las motocicletas con motores de menos de 125 cm no pagarían impuesto.Por primera vez en la historia de la tributación, los vehículos de servicio público, de transporte de carga y pasajeros pagarían este impuesto, con una tasa del 0,5 por ciento. Y los eléctricos e híbridos, el 1 por ciento.Otro componente que se suma al impuesto es el factor de contaminación, llamado impuesto al carbono a una tasa de 1,5 unidades de valor tributario (UVT), que cambia cada año. Para este el valor de una UVT es de $ 36.308, es decir, que el ‘aporte’ sería de unos 54.000 pesos. Esto se pagaría según los valores oficiales de las tablas que expidan los ministerios de Transporte y Ambiente y sería a partir del 1 de enero de 2022.Un impuesto ya conocido por los colombianos, la sobretasa a los combustibles, también aumentaría con esta reforma tributaria, que en el caso de la gasolina tentativamente sería de $ 940 por galón en los municipios y distritos, de $ 330 en departamentos y de $ 1.270 por galón en Bogotá.Un ‘sueño’ que desde hace varios años trasnocha a los mandatarios que han pasado por la alcaldía de Bogotá se cumpliría con esta reforma, que además se les podría cumplir al resto de alcaldes de otras ciudades capitales: los peajes urbanos. Para ello solo tendrían que tener el visto bueno de los concejos municipales.La reforma tributaria también modificaría el valor de las tarifas de las pólizas del Seguro Obligatorio de Accidentes de Tránsito, al unificar su precio para todas las motocicletas, es decir, que la tarifa sería la misma independientemente de la cilindrada. Actualmente las motos de baja cilindrada, menos de 150 cm3, a pesar de que concentran el mayor número de siniestros cada año, pagan una tarifa más baja por este seguro.Uno de los sectores más preocupados por el alcance de la ‘Ley de solidaridad sostenible’, con la cual se espera recaudar $ 26,1 billones, es el del transporte en todas sus modalidades, en particular con lo que pueda pasar con los combustibles, porque los anuncios de nuevos impuestos también los tienen echando números.Y no solo los transportadores hacen cuentas. El Gobierno busca, por su lado, cuadrar las cuentas en el Congreso, y allí también partidos, senadores y representantes hacen las suyas de cara a las próximas elecciones. En ese escenario, a muchos les asusta la cuenta de cobro en las urnas si dan su voto favorable a la reforma.¿QUÉ DICEN LO GREMIOS?EL TIEMPO habló con representantes de las principales agremiaciones del transporte y de combustibles, y aunque algunos sostienen que la reforma es necesaria, coinciden en que no es el momento para imponer nuevos impuestos cuando sus finanzas están golpeadas por la pandemia del covid-19.Alvaro Younes, presidente de Fedispetrol, dijo que “sería un error estratégico de la política de reactivación de la economía (...). Tendría un impacto negativo no solo en lo social por el encarecimiento de la canasta familiar y para el resto de sectores productivos del país. La cadena (de impuestos) iría en cada uno de los pasos generando malestar en los transportadores y encarecería el costo de vida. Si se suma el IVA en cada producto, es como impuestos en cascada y no tendría fin"":Alfonso Medrano, presidente de la Asociación Colombiana de Camioneros (ACC), agremiación que apoyó abiertamente la elección del presidente Iván Duque, dijo estar preocupado. Al cierre de esta edición, la ACC y otras asociaciones de transportadores preparaban un comunicado conjunto con varios puntos dirigido al mandatario. En uno de ellos, piden una reunión urgente en la Casa de Nariño para hablar de la reforma.“Con todo el respeto del señor Presidente, a quien ayudamos elegir los camioneros, porque confiamos en la buena voluntad que nos demostró, nos cumplió pero la pandemia nos tiene descuadrados. No por esto nos puede someter con esta reforma tributaria (...) Le pido el favor respetuosamente al Presidente, nos hemos llevado muy bien, pero creo que va a tocar hacer un alto en el camino para que él reflexione, el Estado no puede venir ahora en plena crisis a sacrificarnos más"".Clarita María García Rúa, directora Ejecutiva de Defencarga, afirmó que la reforma tendrá una gran afectación. Esta semana el equipo de investigaciones de la agremiación analizó y cuantificó el impacto de la reforma. A sus asociados les inquietan varios puntos: peajes urbanos sin que medie concepto vinculante previo del Ministerio de Transporte. Impuesto al carbono (ACPM $ 179 por galón). Sobretasa municipal y departamental al combustible (ACPM $ 301 por galón). Gravamen impuesto nacional de vehículos e impuesto a plásticos de un solo uso.Jairo Herrera, presidente de Asecarga, dijo que le preocupan muchas cosas, entre ellas el IVA a los vehículos y el precio de los combustibles. “Vemos que la reforma es necesaria por la pandemia, pero el parque automotor está trabajando al 60 por ciento. No es que no estemos de acuerdo, pero hay que revisarla y esta reforma merece una reflexión más profunda. De eso queremos hablar con el presidente Duque”, aseguró.Alejandro Quiroga es el representante de la Asamblea Nacional del Transporte, que reúne a conductores de carga pesada y liviana y a propietarios de vehículos pequeños de transporte público urbano y departamental, taxis y escolar. Esta semana analizaron el texto de la reforma y, según el directivo, “el consenso general de la asamblea es que se archive, es inviable”.Explicó que en todas las modalidades de transporte han despedido casi al 50 por ciento de conductores, y el transporte escolar está parado hace un año.REDACCIÓN VEHÍCULOS"
1,"Las pequeñas empresas, las más castigadas por la covid en la región",2021-04-25,"
Las pequeñas y medianas empresas (PYMES) en América Latina y el Caribe (ALC), pero sobre todo aquellas de menor tamaño, han sido las que más han sufrido el impacto de la crisis causada por la covid-19, según el Programa de Naciones Unidas para el Desarrollo (PNUD) que insta a los Gobiernos a invertir en su resiliencia.(Lea: Declaran a 506 empresas como proveedores ficticios ¿a qué se exponen?)
sas.cmd.push(function() { sas.call(""std"", { siteId: sas_siteId, pageId: sas_pageId, formatId: 9343, target: sas_target });});""Las empresas de todos los tamaños se han visto afectadas negativamente por la pandemia en todos los países. Sin embargo, las PYMES -y en particular las pequeñas empresas- han experimentado mayores caídas sostenidas de las ventas, así como han afrontado mayores tasas de cierres permanentes que las grandes empresas"", asegura un documento del director regional del PNUD, Luis Felipe López-Calva. El texto destaca que en el caso de las empresas y la capacidad de responder ante un periodo de vacas flacas, el tamaño importa. ""Su tamaño también es importante. A menudo, las empresas más grandes pueden tener una mayor capacidad para capear una crisis como la de la covid-19.Por ejemplo, si su tamaño les permite acumular una mayor reserva de efectivo, obtener un acceso más fácil a la financiación, invertir en infraestructura de teletrabajo, adaptarse a la prestación de servicios de entrega a domicilio o diversificar su negocio en múltiples ubicaciones"", recoge el escrito. LAS PYMES, UNA FUENTE PRIMARIA DE EMPLEO Para la ONU, la importancia de las PYMES estriba en que América Latina y el Caribe, ""al igual que en muchos países de ingresos medios y bajos, las PYMES son una fuente primaria de empleo y un proveedor clave de bienes y servicios para una gran parte de la población"". ""Se estima que las PYMES representan hasta el 99,5% de todas las empresas de la región, el 60% de la población empleada y el 25% del PIB"", sostiene la nota. Como ejemplo, ofrece una instantánea de las PYMES de la economía formal en los sectores de la manufactura y de los servicios con más de 5 empleados. Además de constatar que, en término medio, generan el 55 % del empleo en estos sectores, también refleja el peso de estas empresas por países. Desde Belize, donde genera el 86 % del trabajo, hasta Chile y México donde solo emplean al 17 % de los trabajadores de ambos sectores. EL CASO DE EL SALVADOR, GUATEMALA, HONDURAS Y NICARAGUAPor otra parte, en un estudio más pormenorizado, centrado en cuatro países -El Salvador, Guatemala, Honduras y Nicaragua-, el PNUD constata como entre el estallido de la crisis hasta agosto de 2020, las pequeñas empresas de El Salvador y Honduras sufrieron caídas de las ventas de hasta el 60 %, que comenzaron a recuperarse entre esa fecha y enero de 2021. Otro dato que destaca la PNUD es que si bien hasta agosto de 2020 pocas empresas cerraron, a partir de ese momento y hasta enero de 2021 los cierres se aceleraron y, por ejemplo, en Honduras el 5,5 % de las pequeñas empresas echaron el cerrojo, y en Nicaragua el 3,5 % corrió la misma suerte. Aunque el PNUD reconoce que no tiene datos suficientes para un análisis homogéneo y pormenorizado, apunta también como ejemplo que, según el Instituto Nacional de Estadística y Geografía de México, entre mayo de 2019 y septiembre de 2020, en este país norteamericano cerraron definitivamente aproximadamente un millón de empresas micro, pequeñas y medianas, es decir un 20,8 % del total de MIPYMES. UN LLAMADO PARA INVERTIR EN LAS PYMES El PNUD califica a las PYMES como una ""fuente crítica de empleo y de prosperidad económica"" para muchas comunidades de la región, por lo que considera que es esencial trabajar para ofrecerles respaldo ""en el camino de la recuperación"". Aunque reconoce que ""el apoyo a las empresas en dificultades (y a sus trabajadores) ha sido una parte central de las estrategias de alivio económico de los gobiernos a lo largo de la pandemia"", considera que ""muchos países de ALC se han enfrentado a retos para proporcionar un apoyo adecuado a las PYMES"". La nota defiende la importancia de invertir tanto en la resistencia como en la productividad de estas empresas para que puedan convertirse en un ""fuerte motor de la recuperación económica en la región"". Para ello, propone a los países de la región que aborden ""algunas de las barreras estructurales a las que se enfrentan las PYMES, como el acceso a la financiación, las inversiones en digitalización e innovación, las cargas regulatorias o los desafíos más amplios en el entorno propicio. EFE"
3,"Reforma: Andi plantea que recaudo baje a $15,4 billones",2021-04-25,"
cional de Empresarios de Colombia (Andi) ya había dado algunas pistas de su contrapropuesta de reforma fiscal, ayer detalló que la idea es que el recaudo baje a $15,4 billones a través de unas nuevas fuentes, contra la iniciativa del Gobierno que aspira a $28 billones.(Lea: Andi dice que espera del Congreso una reforma tributaria concertada)
sas.cmd.push(function() { sas.call(""std"", { siteId: sas_siteId, pageId: sas_pageId, formatId: 9343, target: sas_target });});Según la Andi, los recursos de la reforma que plantea vendrían de suspender el descuento del ICA ($5,2 billones), aplazar el beneficio de renta para empresas ($6,2 billones) y un impuesto al patrimonio para personas naturales por dos años ($1 billón). Con eso, calcula, se podrían recaudar $12,4 billones de forma recurrente.“Nuestra propuesta implica un importante sacrificio en materia de competitividad y un aumento en la tarifa efectiva de tributación del sector empresarial, por ello, la misma tiene carácter transitorio y solo deberá estar vigente mientras subsistan las condiciones de emergencia sanitaria, derivada de la pandemia. De esta manera, será necesario retornar, en los próximos dos años, a los estándares corporativos de tributación (tarifa de renta del 30% y descuento del ICA al 100%) que nos permitan ser competitivos a nivel internacional”, detalla el gremio. A eso le suma otros $3 billones que saldrían de reducir el gasto y la evasión, así como fijar un IVA a productos de lujo o suntuarios.Con eso, la propuesta de la Andi se basa en generar $15,4 billones en ingresos recurrentes para la Nación, lo que sería mucho menor a lo que planteó el Gobierno en el proyecto que radicó ante el Congreso, y con el que busca recaudar $28 billones, y que restando los recursos del Sistema General de Participaciones (las regiones) quedaría en $23,4 billones.Para Bruce Mac Master, presidente de la Andi, “en este momento el país necesita conseguir recursos por más de $90 billones en los próximos años. Por eso, en este momento necesitamos una reforma tributaria, una que nos asegure contar con la sostenibilidad fiscal y en el futuro poder atender los programas de emergencia de la pandemia y mantener las calificaciones de riesgo”, explicó.Otra de las fuentes que destaca la Andi es que el Gobierno obtenga recursos, por una vez, a través de la enajenación o venta de activos, con los que le podrían entrar al país $14 billones.Frente al gasto de esos recursos adicionales, la Asociación plantea que los recursos provenientes de enajenaciones puedan ser utilizados en programas como Ingreso Solidario o el Programa de Apoyo al Empleo Formal (Paef).LA PROPUESTA DEL GOBIERNOFrente a los planteamientos del Gobierno en su iniciativa ‘Solidaridad sostenible’, la Andi resalta que aunque ampliar el IVA y la base gravable del impuesto de renta a personas naturales es parte de las recomendaciones de la Comisión de expertos en beneficios tributarios, “también es consciente de los impactos económicos y sociales que se podrían generar en la población de ingresos bajos y medios”.Eso sí, plantea que su iniciativa es transitoria y que sí se deben hacer unos ajustes en materia fiscal en los próximos años.“Las reformas en estas materias tributarias se deben ejecutar dentro de dos años, cuando el contexto económico y social así lo permita, para corregir las distorsiones en nuestro sistema tributario y que aumenten el recaudo tributario que tiene nuestro país”.Al mismo tiempo, el Consejo Gremial también planteó en días pasados que alista una contrapropuesta de reforma y que será presentada próximamente."
4,No todo está dicho en normas para laborar fuera de la oficina,2021-04-25,"
La reciente legislación sobre el trabajo en casa dejó claras las reglas de juego para trabajadores y empresas que han tenido que operar lejos de la oficina a causa de la crisis sanitaria o por cualquier circunstancia temporal.(Lea: El trabajo remoto impulsará la productividad después de la pandemia)Sin embargo, los expertos consideran que hay ‘zonas grises’ que todavía se deben resolver en esta materia, teniendo en cuenta que los estudios demuestran que, cuando la pandemia sea superada, esta práctica o el modelo híbrido será cada vez más común en las organizaciones, y por ello es necesario modernizar la legislación.(Lea: Trabajo en casa: con subsidio digital y derecho a desconexión)
sas.cmd.push(function() { sas.call(""std"", { siteId: sas_siteId, pageId: sas_pageId, formatId: 9343, target: sas_target });});Así lo advierte Adriana Hincapié, directora de Servicios Laborales, PwC Colombia, quien explica que existe la Ley 1221 del 2008 denominada la Ley del Teletrabajo. El país fue uno de los primeros en establecer estas normas, pero “en la práctica se volvió una legislación muy rígida, poco flexible, con muchas formalidades para aplicar”, sostiene.De hecho, la tendencia en estos años ha sido otorgar a los colaboradores un día de trabajo en casa, más bien en el plan de beneficios.​A su juicio, se debe pensar en cómo actualizarla y llama la atención en que se deben disminuir las cargas administrativas y económicas que tienen las empresas que adoptan el Teletrabajo, definido para quienes se desempeñan fuera de la oficina apoyados en tecnologías de la información.Considera que una oportunidad para esa modernización puede ser la reglamentación pendiente de la nueva Ley de Emprendimiento sancionada en diciembre y que ordena dictar las normas sobre Trabajo Remoto, un concepto que supera el de Teletrabajo, ya que se refiere a las actividades laborales de los llamado nómadas digitales.Incluso, la expectativa es que esta normatividad también aborde el controversial tema de quienes trabajan con las plataformas de domicilio y mensajería.“Uno esperaría una norma un poco más flexible desde el punto de vista de seguridad y salud en el trabajo, que los colaboradores no se tengan que registrarse en el Ministerio”, sostiene.Y agrega la importancia de “una ley que sea muy clara respecto al cubrimiento de las aseguradoras de riesgos laborales, hoy hay un vacío muy grande. Que se equilibren de manera más clara los costos entre empleador y trabajador porque hoy el teletrabajo impone que el empleador asuma todos los gastos”.Portafolio consultó al Ministerio de Trabajo sobre los términos de reglamentación del Trabajo Remoto y dijo que por ahora desarrolla unas mesas técnicas al respecto. Sobre el tema, Mónica García Espinel, directora ejecutiva de la Federación Colombiana de Gestión Humana, Acrip, destaca que la Ley de trabajo en casa es clave para definir cómo llevar las relaciones laborales en tiempos de pandemia, al advertir que muchas organizaciones no están en las condiciones de llevar a la práctica el Teletrabajo.Cree que la Ley del 2008 es importante a pesar de que en una encuesta que se hizo antes de la pandemia solo el 11% de las empresas manejaban esta modalidad.Sin embargo, un año después, otra consulta a las compañías arrojó que un 90% anunció que han tomado la decisión de practicarla al menos uno o dos días de la semana, lo que confirmaría, en coincidencia con Adriana Hincapié, que la tendencia es al modelo híbrido. En esa línea, también está de acuerdo en que es el momento de procurar una modernización que tienda a una mayor flexibilidad.LAS TENDENCIAS INTERNACIONALESUn estudio de Unisys con más de 1.000 líderes y empleados de Colombia, México, Brasil y Chile muestra varios datos sobre la tendencia del trabajo remoto. El 83% de los empleados está de acuerdo con los líderes de las organizaciones (77%) sobre el hecho de que son tan productivos o más en casa o en otra ubicación remota frente a la oficina. El 39% de los empleados señala además que prefiere trabajar fuera de los límites de la empresa, en lugares como casas, cafeterías y oficinas compartidas."
5,Remesas de los trabajadores marcan un récord en marzo,2021-04-25,"
Desde cuando el Banco de la República registra el ingreso de remesas de trabajadores a Colombia, un mes no había marcado una cifra tan alta como la que llegó en marzo, cuando estas fueron de US$788,5 millones.(Lea: Colombia, pendiente de la fortaleza del dólar)De paso, el cierre del primer trimestre del año consolidó US$1.961 millones, que también se constituyó en una cifra sin precedentes para un inicio de año.(Lea: Remesas, rumbo a un nuevo récord en 2021)
sas.cmd.push(function() { sas.call(""std"", { siteId: sas_siteId, pageId: sas_pageId, formatId: 9343, target: sas_target });});La cifra del tercer mes del año es superior en 10,1% a la del mismo mes del 2020 cuando en ese periodo habían llegado U$715,9 millones y frente al mismo trimestre de 2020 el aumento fue de 11,5% cuando el consolidado fue de US$1.758 millones.​El buen comportamiento de las remesas se ha venido dando precisamente desde cuando comenzó la pandemia, lo que hizo que el 2020 fuera el de mejor comportamiento con una llegada de recursos por US$6.902 millones. En promedio, entre enero y marzo llegaron al país US$21,7 millones diarios. En 2020 el promedio diario fue de US$18,8 millones.Para Camilo Pérez, jefe de investigaciones económicas del Banco de Bogotá, detrás del repunte en la llegada de remesas al país está la recuperación económica global y “los subsidios que el gobierno de Estados Unidos está entregando, los que en parte se han convertido en remesas hacia Colombia y otras naciones”.Y es que con una previsión de crecimiento entre el 6% y el 8% en el crecimiento del PIB de Estados Unidos este año, influida por el buen plan de vacunación, las bajas tasas de interés y los paquetes de estímulo del gobierno, los trabajadores extranjeros van a poder enviar más recursos a sus respectivos países, indica el director de investigaciones económicas del Grupo Bolívar Davivienda, Andrés Langebaek.El economista dijo que es muy probable que este año se vuelvan a registrar cifras más altas en la llegada de estos recursos y recordó que algunos países centroamericanos derivan hasta más del 20% de su PIB de los recursos que envían los trabajadores.Las remesas a Colombia llegan principalmente desde EE. UU. y España, aunque en los últimos años también se ha visto un repunte de otros lugares como Chile, Ecuador, Argentina y Francia.Además, representan el 2,5% del PIB de Colombia."
