,titulo,fecha,texto
0,Terminar con la pandemia requiere un Plan Marshall global,2021-04-24,"Las reuniones de primavera Fondo Monetario Internacional y del Banco Mundial son una posibilidad histórica para la cooperación financiera. Las principales economías, entre ellas Estados Unidos, la Unión Europea, China y otros países del G20, ya han señalado su apoyo a una nueva asignación de 650.000 millones de dólares de los activos de reserva del FMI, los derechos especiales de giro (DEG), para garantizar que los gobiernos en países de bajos y medianos ingresos tengan los medios para combatir la pandemia de covid-19 y se encaminen en el sendero de la recuperación liderada por la inversión. Con liderazgo, audacia y creatividad, esta cooperación financiera global puede ayudar a poner fin a la pandemia."
1,"Las cajas de compensación aportarán a la reactivación $ 1,4 billones",2021-04-24,"Ayudas monetarias por más de 3,5 billones de pesos les entregaron el año pasado a sus afiliados las cajas de compensación familiar (CCF) en medio de la crisis generada por la pandemia del covid-19, la misma que dejó a estas entidades con 425.000 trabajadores menos afiliados, un bajo crecimiento (en 2019 fue cercano al 11 por ciento) y una fuerte reducción en sus ingresos."
2,Alternativas de congresistas a reforma no mencionan ampliar ayudas,2021-04-24,"La discusión del proyecto de 'Ley de Solidaridad Sostenible' en el Congreso de la República aún no comienza, pero la primera lectura del mismo por parte de los distintos partidos políticos, cuyos legisladores tendrán la misión de aprobar o no la iniciativa, ya deja ver que esta tendrá varios ajustes a lo largo de su discusión.Varios congresistas muestran su rechazo a algunos puntos del proyecto, presentan alternativas que apuntan a recaudar menos recursos, pero no plantean nada sobre la ampliación del número de familias pobres y vulnerables que reciben Ingreso Solidario y el incremento de la devolución del IVA, objetivos centrales del proyecto.(Lea también: En Cuba, el pago de impuestos es el doble que en Colombia)"
3,Bancolombia abre nuevas vacantes con contrato a término indefinido,2021-04-24,"Bancolombia anunció, a través de su portal web, que está ofreciendo vacantes para distintos cargos en la modalidad de contrato indefinido en las principales ciudades del país. Conozca los perfiles que está buscando la entidad y cómo postularse a los cargos."
4,En febrero el empleo formal en Colombia se recuperó,2021-04-24,"Aunque los empleos como independientes están ganando terreno en la recuperación de los puestos de trabajo en el país, febrero dio algunas señales de mejora para los formales.(Lea también: En Cuba, el pago de impuestos es el doble que en Colombia)"
5,S&P mantiene nota de Colombia: primer efecto de la reforma,2021-04-24,"En medio de la tensión que reina en el país por el trámite de la reforma tributaria, la calificadora de riesgo Standard & Poor's (S&P) le mantuvo la nota soberana a Colombia, en BBB-, pero no modificó su perspectiva negativa. La firma, no obstante, subió su pronóstico de crecimiento del país.(Lea también: Así ha cambiado la imagen de estas reconocidas marcas colombianas) "
6,Ojalá que covid cambie lógica de políticos para discutir reforma: Ocde,2021-04-24,"Los expertos de la Organización para la Cooperación y el Desarrollo Económicos (Ocde), junto a sus colegas de las principales instituciones multilaterales, consideran indispensable que Colombia haga, entre otras, reformas fiscales y sociales, como las que contiene el proyecto que se radicó días atrás en el Congreso.Sin embargo, en un informe de la misma Ocde se comentó hace unos días que “con elecciones en 2022, el periodo político para hacerlo es breve”.El secretario general de la organización, Ángel Gurría, se refirió a estos retos de Colombia para seguir respaldando a la población pobre, más golpeada por la pandemia, y disminuir la desigualdad."
7,¿Qué hogares recibirían $366 mil de ingreso solidario con la reforma?,2021-04-24,"Los hogares en pobreza extrema y pobreza recibirán una ayuda de entre 80.000 y 366.101 pesos, los primeros, y de entre 80.000 y 252.142 pesos los segundos, según el número de integrantes que tenga cada familia. Es lo que plantea el Gobierno en el proyecto de reforma fiscal.(Le puede interesar: Consulte si es beneficiario de algún subsidio a través de Bancolombia)"
